# Dialogue ID	Turn Index	User Utterance	System Response	attraction-area	attraction-name	attraction-type	bus-day	bus-departure	bus-destination	bus-leaveAt	hospital-department	hotel-area	hotel-book day	hotel-book people	hotel-book stay	hotel-internet	hotel-name	hotel-parking	hotel-price range	hotel-stars	hotel-type	restaurant-area	restaurant-book day	restaurant-book people	restaurant-book time	restaurant-food	restaurant-name	restaurant-price range	taxi-arrive by	taxi-departure	taxi-destination	taxi-leave at	train-arrive by	train-book people	train-day	train-departure	train-destination	train-leave at	
SNG0091.json	2	Thank you very much! 	I have booked you a yellow bmw. The contact number is 07333936064.	none	none	none	none	none	none	none	none	none	none	none	none	none	none	none	none	none	none	none	none	none	none	none	none	none	none	saigon city	rosa's bed and breakfast	17:45	none	none	none	none	none	none
SNG0091.json	3	No, that's all. Goodbye.	Is there anything else you need help with today?	none	none	none	none	none	none	none	none	none	none	none	none	none	none	none	none	none	none	none	none	none	none	none	none	none	none	saigon city	rosa's bed and breakfast	17:45	none	none	none	none	none	none
SNG01488.json	0	I need to book a taxi to come by Saffron Brasserie by 03:30.		none	none	none	none	none	none	none	none	none	none	none	none	none	none	none	none	none	none	none	none	none	none	none	none	none	none	saffron brasserie	none	03:30	none	none	none	none	none	none
SNG01488.json	1	I'm coming from saffron brasserie.	I'd be happy to help! Where are you coming from? 	none	none	none	none	none	none	none	none	none	none	none	none	none	none	none	none	none	none	none	none	none	none	none	none	none	none	saffron brasserie	none	03:30	none	none	none	none	none	none
SNG01488.json	2	I'm going to leicester train station and need to arrive there by 03:30	Where will you be going?	none	none	none	none	none	none	none	none	none	none	none	none	none	none	none	none	none	none	none	none	none	none	none	none	none	none	saffron brasserie	leicester train station	none	none	none	none	none	none	none
SNG01488.json	3	Yes, that is correct	Just want to confirm before booking you are departing from saffron brasserie and want to arrive at leicester by 3:30, is that correct?	none	none	none	none	none	none	none	none	none	none	none	none	none	none	none	none	none	none	none	none	none	none	none	none	none	03:30	saffron brasserie	leicester train station	none	none	none	none	none	none	none
SNG01488.json	4	Thanks, that's all I need. Good bye.	Booking completed! Booked car type : white ford Contact number : 07379980416 	none	none	none	none	none	none	none	none	none	none	none	none	none	none	none	none	none	none	none	none	none	none	none	none	none	03:30	saffron brasserie	leicester train station	none	none	none	none	none	none	none
SNG02002.json	0	I need to book a taxi to come to Da Vinci Pizzeria by 01:45.		none	none	none	none	none	none	none	none	none	none	none	none	none	none	none	none	none	none	none	none	none	none	none	none	none	01:45	none	da vinci pizzeria	none	none	none	none	none	none	none
SNG02002.json	1	I am going to Cambridge Road Church of Christ.	I can help you with that. where are you going?	none	none	none	none	none	none	none	none	none	none	none	none	none	none	none	none	none	none	none	none	none	none	none	none	none	none	da vinci pizzeria	cambridge road church of christ	01:45	none	none	none	none	none	none
SNG02002.json	2	Thank you for your help that is all I need today	Your booking is complete. The taxi is a yellow Honda. Contact number 07024160438.	none	none	none	none	none	none	none	none	none	none	none	none	none	none	none	none	none	none	none	none	none	none	none	none	none	none	da vinci pizzeria	cambridge road church of christ	01:45	none	none	none	none	none	none
SNG02324.json	0	Yes, i would like you to book a taxi for arrival by 10:45 from the maharajah tandoori restaurant. 		none	none	none	none	none	none	none	none	none	none	none	none	none	none	none	none	none	none	none	none	none	none	none	none	none	10:45	maharajah tandoori restaurant	none	none	none	none	none	none	none	none
SNG02324.json	1	I would like to leave at 10:45	What time would you like to leave the restaurant?	none	none	none	none	none	none	none	none	none	none	none	none	none	none	none	none	none	none	none	none	none	none	none	none	none	10:45	maharajah tandoori restaurant	none	10:45	none	none	none	none	none	none
SNG02324.json	2	I want to arrive by 10:45.	Can you confirm for me whether 10:45 is your required arrival time or is it when you'd like to depart? And what is your destination?	none	none	none	none	none	none	none	none	none	none	none	none	none	none	none	none	none	none	none	none	none	none	none	none	none	10:45	maharajah tandoori restaurant	none	none	none	none	none	none	none	none
SNG02324.json	3	I am wanting to go to Old Schools.	You want to arrive by 10:45 at which destination, please? 	none	none	none	none	none	none	none	none	none	none	none	none	none	none	none	none	none	none	none	none	none	none	none	none	none	10:45	maharajah tandoori restaurant	old schools	none	none	none	none	none	none	none
SNG02324.json	4	No that's all, thank you	Alright I have a white ford for you. The contact number is 07314884392. Is there anything else you need?	none	none	none	none	none	none	none	none	none	none	none	none	none	none	none	none	none	none	none	none	none	none	none	none	none	10:45	maharajah tandoori restaurant	old schools	none	none	none	none	none	none	none
SNG01602.json	0	I need the phone number and location of the nearest Red Lobster in the downtown Cambridge area.		none	none	none	none	none	none	none	none	none	none	none	none	none	none	none	none	none	none	none	none	none	none	none	none	none	none	none	none	none	none	none	none	none	none	none
SNG01602.json	1	I need a taxi,from darrys cookhouse and wine shop and go to restaurant two two and leave at 9 00	I'm sorry, could you please repeat your request? There seems to be an error. 	none	none	none	none	none	none	none	none	none	none	none	none	none	none	none	none	none	none	none	none	none	none	none	none	none	none	darrys cookhouse and wine shop	restaurant two two	9:00	none	none	none	none	none	none
SNG01602.json	2	Thank you for your quick response.	Your booking is complete. The car type is a yellow tesla and the contact number is 07556741489.	none	none	none	none	none	none	none	none	none	none	none	none	none	none	none	none	none	none	none	none	none	none	none	none	none	none	darrys cookhouse and wine shop	restaurant two two	9:00	none	none	none	none	none	none
SNG01602.json	3	No, that should be it. I really appreciate your help!	You are very welcome please let us know if we may help with anything else.	none	none	none	none	none	none	none	none	none	none	none	none	none	none	none	none	none	none	none	none	none	none	none	none	none	none	darrys cookhouse and wine shop	restaurant two two	9:00	none	none	none	none	none	none
SNG01466.json	0	I would like to book a taxi please.		none	none	none	none	none	none	none	none	none	none	none	none	none	none	none	none	none	none	none	none	none	none	none	none	none	none	none	none	none	none	none	none	none	none	none
SNG01466.json	1	I need to go to broughton house gallery.	Where would you like to go?	none	none	none	none	none	none	none	none	none	none	none	none	none	none	none	none	none	none	none	none	none	none	none	none	none	none	none	broughton house gallery	none	none	none	none	none	none	none
SNG01466.json	2	I am leaving from the junction. 	I'd be happy to book that for you, where will you need picked up?	none	none	none	none	none	none	none	none	none	none	none	none	none	none	none	none	none	none	none	none	none	none	none	none	none	none	the junction	broughton house gallery	none	none	none	none	none	none	none
SNG0021.json	0	Hi, I would like to get a taxi from whale of a time. I'll need to leave after 22:45.		none	none	none	none	none	none	none	none	none	none	none	none	none	none	none	none	none	none	none	none	none	none	none	none	none	none	whale of a time	none	22:45	none	none	none	none	none	none
SNG0021.json	1	I would like to go to Citi Stop Restaurant 	Could you tell me your destination, please? 	none	none	none	none	none	none	none	none	none	none	none	none	none	none	none	none	none	none	none	none	none	none	none	none	none	none	whale of a time	city stop restaurant	22:45	none	none	none	none	none	none
SNG0021.json	2	nope thats all thank you!	Ok, I have you booked to leave at 22:45. The car is a yellow Skoda and their contact number is 07314230139. Anything else I can do for you?	none	none	none	none	none	none	none	none	none	none	none	none	none	none	none	none	none	none	none	none	none	none	none	none	none	none	whale of a time	city stop restaurant	22:45	none	none	none	none	none	none
SNG01526.json	0	I need a taxi departing from the gardenia.		none	none	none	none	none	none	none	none	none	none	none	none	none	none	none	none	none	none	none	none	none	none	none	none	none	none	the gardenia	none	none	none	none	none	none	none	none
SNG01526.json	1	I would like yo leave after 6:30.	I'd be happy to help. What time would you like to leave and/or arrive by?	none	none	none	none	none	none	none	none	none	none	none	none	none	none	none	none	none	none	none	none	none	none	none	none	none	none	the gardenia	none	06:30	none	none	none	none	none	none
SNG01526.json	2	I'm going to the slug and lettuce.	I can help you with that. where are you going?	none	none	none	none	none	none	none	none	none	none	none	none	none	none	none	none	none	none	none	none	none	none	none	none	none	none	the gardenia	the slug and lettuce	06:45	none	none	none	none	none	none
SNG01526.json	3	That's all, thanks!	Your taxi booking is for a red lexus with the contact number 07652996605. 	none	none	none	none	none	none	none	none	none	none	none	none	none	none	none	none	none	none	none	none	none	none	none	none	none	none	the gardenia	the slug and lettuce	06:45	none	none	none	none	none	none
SNG01526.json	4	No thank you that will be all	You're welcome. Can I help you with anything else today?	none	none	none	none	none	none	none	none	none	none	none	none	none	none	none	none	none	none	none	none	none	none	none	none	none	none	the gardenia	the slug and lettuce	06:45	none	none	none	none	none	none
SNG01170.json	0	I need a taxi from peking restaurant.		none	none	none	none	none	none	none	none	none	none	none	none	none	none	none	none	none	none	none	none	none	none	none	none	none	none	peking restaurant	none	none	none	none	none	none	none	none
SNG01170.json	1	I need to arrive at 10:45.	I can help you with that. When do you need to leave?	none	none	none	none	none	none	none	none	none	none	none	none	none	none	none	none	none	none	none	none	none	none	none	none	none	10:45	peking restaurant	none	none	none	none	none	none	none	none
SNG01170.json	2	I will be going to Maharajah Tandoori restaurant.	What is your destination after leaving peking restaurant?	none	none	none	none	none	none	none	none	none	none	none	none	none	none	none	none	none	none	none	none	none	none	none	none	none	10:45	peking restaurant	maharajah tandoori restaurant4	none	none	none	none	none	none	none
SNG01170.json	3	Do you mean a blue audi?	Ok I have a blue audio for you with the contact number 07304585611.	none	none	none	none	none	none	none	none	none	none	none	none	none	none	none	none	none	none	none	none	none	none	none	none	none	10:45	peking restaurant	maharajah tandoori restaurant4	none	none	none	none	none	none	none
SNG01170.json	4	Thanks, that's all I need. Good bye.	Yes, I apologize you should be looking for a Blue Audi. The contact number is 07304585611	none	none	none	none	none	none	none	none	none	none	none	none	none	none	none	none	none	none	none	none	none	none	none	none	none	10:45	peking restaurant	maharajah tandoori restaurant4	none	none	none	none	none	none	none
SNG01181.json	0	I need to book a taxi departing from parkside police station.		none	none	none	none	none	none	none	none	none	none	none	none	none	none	none	none	none	none	none	none	none	none	none	none	none	none	parkside police station	none	none	none	none	none	none	none	none
SNG01181.json	1	i need to go to aylesbray lodge guest house.	Okay, what is your destination?	none	none	none	none	none	none	none	none	none	none	none	none	none	none	none	none	none	none	none	none	none	none	none	none	none	none	parkside police station	aylesbray lodge guest house	none	none	none	none	none	none	none
SNG01181.json	2	I need to arrive by 18:15.	Okay, what time do you want to leave?	none	none	none	none	none	none	none	none	none	none	none	none	none	none	none	none	none	none	none	none	none	none	none	none	none	18:15	parkside police station	aylesbray lodge guest house	none	none	none	none	none	none	none
SNG01271.json	0	Please book me a taxi to club salsa after 01:30.		none	none	none	none	none	none	none	none	none	none	none	none	none	none	none	none	none	none	none	none	none	none	none	none	none	none	none	club salsa	01:30	none	none	none	none	none	none
SNG01271.json	1	I am at saint john's college.	I can book you a taxi to club salsa at 1:30. Where do you need to be picked up?	none	none	none	none	none	none	none	none	none	none	none	none	none	none	none	none	none	none	none	none	none	none	none	none	none	none	saint john's college	club salsa	01:30	none	none	none	none	none	none
SNG01271.json	2	I want to arrive by 02:30.	What time would you like to arrive by?	none	none	none	none	none	none	none	none	none	none	none	none	none	none	none	none	none	none	none	none	none	none	none	none	none	none	saint john's college	club salsa	none	none	none	none	none	none	none
SNG01271.json	3	I'm sorry for the mixup. I want to leave after 01:30.	Before booking, please confirm either your arrival or departure time. There are 2 different times stated, so I want to be sure before reserving.	none	none	none	none	none	none	none	none	none	none	none	none	none	none	none	none	none	none	none	none	none	none	none	none	none	none	saint john's college	club salsa	01:30	none	none	none	none	none	none
SNG01271.json	4	Thanks! That would be all. 	Booking completed! Anything else I can help with? Booked car type : yellow ford Contact number : 07427696778 	none	none	none	none	none	none	none	none	none	none	none	none	none	none	none	none	none	none	none	none	none	none	none	none	none	none	saint john's college	club salsa	01:30	none	none	none	none	none	none
SNG02257.json	0	I need a taxi to come to gallery at twelve a high street by 4:00.		none	none	none	none	none	none	none	none	none	none	none	none	none	none	none	none	none	none	none	none	none	none	none	none	none	none	gallery at twelve a high street	none	04:00	none	none	none	none	none	none
SNG02257.json	1	I want to the gallery at twelve high street. 	Ok, where do you need to go?	none	none	none	none	none	none	none	none	none	none	none	none	none	none	none	none	none	none	none	none	none	none	none	none	none	none	gallery at twelve a high street	none	04:00	none	none	none	none	none	none
SNG02257.json	2	I am departing from the junction and going to gallery at twelve.	I'm sorry, can you confirm if you're leaving from or going to Gallery at Twelve a High Street?	none	none	none	none	none	none	none	none	none	none	none	none	none	none	none	none	none	none	none	none	none	none	none	none	none	04:00	the junction	gallery at twelve a high street	none	none	none	none	none	none	none
SNG02257.json	3	Okay thank you!	You'll be picked up at the junction, to gallery at twelve a high, by 4:00. Your auto is a grey skoda, contact number: 07355269466.	none	none	none	none	none	none	none	none	none	none	none	none	none	none	none	none	none	none	none	none	none	none	none	none	none	04:00	the junction	gallery at twelve a high street	none	none	none	none	none	none	none
SNG02257.json	4	No, that will be all. Thank you.	You're welcome. Is there anything else I can help you with today?	none	none	none	none	none	none	none	none	none	none	none	none	none	none	none	none	none	none	none	none	none	none	none	none	none	04:00	the junction	gallery at twelve a high street	none	none	none	none	none	none	none
SNG01219.json	0	I need a taxi departing from tang chinese.		none	none	none	none	none	none	none	none	none	none	none	none	none	none	none	none	none	none	none	none	none	none	none	none	none	none	tang chinese	none	none	none	none	none	none	none	none
SNG01219.json	1	I need to get to Downing college. 	Ok, what is your destination?	none	none	none	none	none	none	none	none	none	none	none	none	none	none	none	none	none	none	none	none	none	none	none	none	none	none	tang chinese	downing college	none	none	none	none	none	none	none
SNG01219.json	2	I need to arrive by 19:30	Great. Now I will just need a time.	none	none	none	none	none	none	none	none	none	none	none	none	none	none	none	none	none	none	none	none	none	none	none	none	none	none	tang chinese	downing college	19:30	none	none	none	none	none	none
SNG01219.json	3	No that is all I needed.	Alright. I have a white bmw and the contact number is 07454674026. Anything else?	none	none	none	none	none	none	none	none	none	none	none	none	none	none	none	none	none	none	none	none	none	none	none	none	none	19:30	tang chinese	downing college	none	none	none	none	none	none	none
SNG01219.json	4	Great. Thank you very much.	I'm sorry, I thought you wanted to leave at 19:30. You are booked for a yellow bmw with the contact number 07816577086 arriving at 19:30.	none	none	none	none	none	none	none	none	none	none	none	none	none	none	none	none	none	none	none	none	none	none	none	none	none	19:30	tang chinese	downing college	none	none	none	none	none	none	none
SNG01219.json	5	No, that's it. Thanks.	Can I help you with anything else?	none	none	none	none	none	none	none	none	none	none	none	none	none	none	none	none	none	none	none	none	none	none	none	none	none	19:30	tang chinese	downing college	none	none	none	none	none	none	none
SNG01464.json	0	Book me a taxi to come by 19:30 to take me to ADC Theatre.		none	none	none	none	none	none	none	none	none	none	none	none	none	none	none	none	none	none	none	none	none	none	none	none	none	none	none	adc theatre	19:30	none	none	none	none	none	none
SNG01464.json	1	I'm leaving from pizza express fen ditton	I would be happy to help with your request, where will you be departing from?	none	none	none	none	none	none	none	none	none	none	none	none	none	none	none	none	none	none	none	none	none	none	none	none	none	none	pizza express fen ditton	adc theatre	19:30	none	none	none	none	none	none
SNG01464.json	2	No that's everything. Thanks!	You're all set. A red audi will pick you up and the contact number, should you need it, is 07397899345. Can I help with anything else?	none	none	none	none	none	none	none	none	none	none	none	none	none	none	none	none	none	none	none	none	none	none	none	none	none	none	pizza express fen ditton	adc theatre	19:30	none	none	none	none	none	none
SNG0040.json	0	I need to book a taxi. I need it to arrive by 19:15 to go to park side pools.		none	none	none	none	none	none	none	none	none	none	none	none	none	none	none	none	none	none	none	none	none	none	none	none	none	none	none	parkside pools	19:15	none	none	none	none	none	none
SNG0040.json	1	I would like to depart from A and B Guest House.	Okay, could you tell me where you would like to depart from?	none	none	none	none	none	none	none	none	none	none	none	none	none	none	none	none	none	none	none	none	none	none	none	none	none	19:15	a and b guest house	parkside pools	none	none	none	none	none	none	none
SNG0040.json	2	That's all the help I need. Thank you.	I have your taxi scheduled. The car type is a black Volkswagen, contact number 07057340221. How else can I help you?	none	none	none	none	none	none	none	none	none	none	none	none	none	none	none	none	none	none	none	none	none	none	none	none	none	19:15	a and b guest house	parkside pools	none	none	none	none	none	none	none
SNG01478.json	0	Can you help me get to ely train station by 12:00?		none	none	none	none	none	none	none	none	none	none	none	none	none	none	none	none	none	none	none	none	none	none	none	none	none	12:00	none	ely train station	none	none	none	none	none	none	none
SNG01478.json	1	I'll be leaving from eraina	Yes. Where will you be leaving from?	none	none	none	none	none	none	none	none	none	none	none	none	none	none	none	none	none	none	none	none	none	none	none	none	none	12:00	eraina	ely train station	none	none	none	none	none	none	none
SNG01478.json	2	No thanks, that's all for now.	Okay. I have a black audi and the contact number is 07356404697. Is there anything else you need?	none	none	none	none	none	none	none	none	none	none	none	none	none	none	none	none	none	none	none	none	none	none	none	none	none	12:00	eraina	ely train station	none	none	none	none	none	none	none
SNG02258.json	0	Hi, I need to get a taxi out of kohinoor. 		none	none	none	none	none	none	none	none	none	none	none	none	none	none	none	none	none	none	none	none	none	none	none	none	none	none	kohinoor	none	none	none	none	none	none	none	none
SNG02258.json	1	I need to leave after 07:45.	And when would you like to leave or arrive by?	none	none	none	none	none	none	none	none	none	none	none	none	none	none	none	none	none	none	none	none	none	none	none	none	none	none	kohinoor	none	07:45	none	none	none	none	none	none
SNG02258.json	2	I am going to allenbell	I'd love to help! Where are you going?	none	none	none	none	none	none	none	none	none	none	none	none	none	none	none	none	none	none	none	none	none	none	none	none	none	none	kohinoor	allenbell	07:45	none	none	none	none	none	none
SNG02258.json	3	Thats perfect that you for your help	Your booking is complete, a black toyota will pick you up. The contact number is 07768938666.	none	none	none	none	none	none	none	none	none	none	none	none	none	none	none	none	none	none	none	none	none	none	none	none	none	none	kohinoor	allenbell	07:45	none	none	none	none	none	none
SNG02258.json	4	I don't. I appreciate your help. Goodbye for now.	You're welcome. Do you have any other concerns?	none	none	none	none	none	none	none	none	none	none	none	none	none	none	none	none	none	none	none	none	none	none	none	none	none	none	kohinoor	allenbell	07:45	none	none	none	none	none	none
SNG01867.json	0	I need a taxi to arrive by 09:45		none	none	none	none	none	none	none	none	none	none	none	none	none	none	none	none	none	none	none	none	none	none	none	none	none	09:45	none	none	none	none	none	none	none	none	none
SNG01867.json	1	The pickup location will be finches bed and breakfast	I'd be happy to help! Where are you coming from?	none	none	none	none	none	none	none	none	none	none	none	none	none	none	none	none	none	none	none	none	none	none	none	none	none	09:45	finches bed and breakfast	none	none	none	none	none	none	none	none
SNG01867.json	2	I will be traveling to sidney sussex college today.	Ok, I will also need your destination for booking purposes.	none	none	none	none	none	none	none	none	none	none	none	none	none	none	none	none	none	none	none	none	none	none	none	none	none	09:45	finches bed and breakfast	sidney sussex college	none	none	none	none	none	none	none
SNG01867.json	3	Is 9:00 good? Do you think forty-five minutes is enough time to get to the college?	Do you have a time you would like to leave by?	none	none	none	none	none	none	none	none	none	none	none	none	none	none	none	none	none	none	none	none	none	none	none	none	none	09:45	finches bed and breakfast	sidney sussex college	09:00	none	none	none	none	none	none
SNG01867.json	4	Great. Can I get a contact number?	Yes, the taxi will pick you up at 9:00. It is a yellow lexus.	none	none	none	none	none	none	none	none	none	none	none	none	none	none	none	none	none	none	none	none	none	none	none	none	none	09:45	finches bed and breakfast	sidney sussex college	09:00	none	none	none	none	none	none
SNG01867.json	5	That's all thanks	Of course, the contact number is 07336173784. Is there anything else you need?	none	none	none	none	none	none	none	none	none	none	none	none	none	none	none	none	none	none	none	none	none	none	none	none	none	09:45	finches bed and breakfast	sidney sussex college	09:00	none	none	none	none	none	none
SNG0088.json	0	I need to book a taxi from warkworth house.		none	none	none	none	none	none	none	none	none	none	none	none	none	none	none	none	none	none	none	none	none	none	none	none	none	none	warkworth house	none	none	none	none	none	none	none	none
SNG0088.json	1	i want to go to rosa's bed and breakfast and would like to arrive by 3	I will need a little more information before I can book it. What is your destination and what time do you want to depart/arrive?	none	none	none	none	none	none	none	none	none	none	none	none	none	none	none	none	none	none	none	none	none	none	none	none	none	03:00	warkworth house	rosa's bed and breakfast	none	none	none	none	none	none	none
SNG0088.json	2	Thank you for your help today.	I have booked you a taxi from Warkworth house to Rosa's Bed and Breakfast. You will arrive by 3. The taxi is a blue skoda. Contact number: 07517822602	none	none	none	none	none	none	none	none	none	none	none	none	none	none	none	none	none	none	none	none	none	none	none	none	none	03:00	warkworth house	rosa's bed and breakfast	none	none	none	none	none	none	none
SNG0088.json	3	That's all I need, thanks. Bye bye!	Certainly. Is there anything else I can do for you? 	none	none	none	none	none	none	none	none	none	none	none	none	none	none	none	none	none	none	none	none	none	none	none	none	none	03:00	warkworth house	rosa's bed and breakfast	none	none	none	none	none	none	none
SNG0059.json	0	I would like to book a taxi that will depart from Rice Boat and should leave at 9:30.		none	none	none	none	none	none	none	none	none	none	none	none	none	none	none	none	none	none	none	none	none	none	none	none	none	none	rice boat	none	09:30	none	none	none	none	none	none
SNG0059.json	1	The taxi should go to parkside pools.	What is your destination?	none	none	none	none	none	none	none	none	none	none	none	none	none	none	none	none	none	none	none	none	none	none	none	none	none	none	rice boat	parkside pools	09:30	none	none	none	none	none	none
SNG0059.json	2	Thank you, goodbye!	Your taxi is a Grey Toyota. The Contact number is 07725254029.	none	none	none	none	none	none	none	none	none	none	none	none	none	none	none	none	none	none	none	none	none	none	none	none	none	none	rice boat	parkside pools	09:30	none	none	none	none	none	none
