# Dialogue ID	Turn Index	User Utterance	System Response	attraction-area	attraction-name	attraction-type	bus-day	bus-departure	bus-destination	bus-leaveAt	hospital-department	hotel-area	hotel-book day	hotel-book people	hotel-book stay	hotel-internet	hotel-name	hotel-parking	hotel-price range	hotel-stars	hotel-type	restaurant-area	restaurant-book day	restaurant-book people	restaurant-book time	restaurant-food	restaurant-name	restaurant-price range	taxi-arrive by	taxi-departure	taxi-destination	taxi-leave at	train-arrive by	train-book people	train-day	train-departure	train-destination	train-leave at	
SNG1197.json	0	I need a taxi to pick me up at curry prince at 08:15.		none	none	none	none	none	none	none	none	none	none	none	none	none	none	none	none	none	none	none	none	none	none	none	none	none	none	curry prince	none	08:15	none	none	none	none	none	none
SNG1197.json	1	My destination is kettle's yard, and anytime after 8:15 would be fine. Please notify me of the car type and the contact number. Thank you.	Where is your destination and what time would you like to arrive by?	none	none	none	none	none	none	none	none	none	none	none	none	none	none	none	none	none	none	none	none	none	none	none	none	none	none	curry prince	kettle's yard	08:15	none	none	none	none	none	none
SNG1197.json	2	That is all I needed, thank you. 	Ok, I have booked you a grey Audi for an 8:15 pickup. The contact number is 07249275156.	none	none	none	none	none	none	none	none	none	none	none	none	none	none	none	none	none	none	none	none	none	none	none	none	none	none	curry prince	kettle's yard	08:15	none	none	none	none	none	none
SNG01381.json	0	I need a taxi to take me in time for my reservation to tang chinese today		none	none	none	none	none	none	none	none	none	none	none	none	none	none	none	none	none	none	none	none	none	none	none	none	none	none	none	tang chinese	none	none	none	none	none	none	none
SNG01381.json	1	I am leaving from the backstreet bistro.	Where will you leave from?	none	none	none	none	none	none	none	none	none	none	none	none	none	none	none	none	none	none	none	none	none	none	none	none	none	none	backstreet bistro	tang chinese	none	none	none	none	none	none	none
SNG01381.json	2	I want to arrive by 18:00	Alright. I will just need a time from you please.	none	none	none	none	none	none	none	none	none	none	none	none	none	none	none	none	none	none	none	none	none	none	none	none	none	18:00	backstreet bistro	tang chinese	none	none	none	none	none	none	none
SNG01381.json	3	Great, thanks! That was everything.	Booking is complete, a grey tesla will be arriving at 18:00. The contact number is 07243724592. Do you need any further assistance? .	none	none	none	none	none	none	none	none	none	none	none	none	none	none	none	none	none	none	none	none	none	none	none	none	none	18:00	backstreet bistro	tang chinese	none	none	none	none	none	none	none
SNG02298.json	0	I would like for a taxi to take me to london liverpool street train station, arriving no later than 17:45 please		none	none	none	none	none	none	none	none	none	none	none	none	none	none	none	none	none	none	none	none	none	none	none	none	none	17:45	none	london liverpool street train station	none	none	none	none	none	none	none
SNG02298.json	1	I would like to depart from London Kings Cross Train Station.	I can book that for you, first I'll need to know where you'd like picked up at.	none	none	none	none	none	none	none	none	none	none	none	none	none	none	none	none	none	none	none	none	none	none	none	none	none	17:45	london kings cross train station	london liverpool street train station	none	none	none	none	none	none	none
SNG02298.json	2	Excellent, can I get a contact number please?	A white Toyota is booked for you.	none	none	none	none	none	none	none	none	none	none	none	none	none	none	none	none	none	none	none	none	none	none	none	none	none	17:45	london kings cross train station	london liverpool street train station	none	none	none	none	none	none	none
SNG02298.json	3	that's great. thanks	Of course. The contact number is 07689939820. Can I help with anything further?	none	none	none	none	none	none	none	none	none	none	none	none	none	none	none	none	none	none	none	none	none	none	none	none	none	17:45	london kings cross train station	london liverpool street train station	none	none	none	none	none	none	none
SNG02298.json	4	Thank you goodbye	I would like a taxi to take me to London liverpool street train station	none	none	none	none	none	none	none	none	none	none	none	none	none	none	none	none	none	none	none	none	none	none	none	none	none	17:45	london kings cross train station	london liverpool street train station	none	none	none	none	none	none	none
SNG1322.json	0	I there! I hope you're having a nice day. Hi, I need ride or taxi from Lovell lodge to Holy Trinity Church around 10:30. What are my options?		none	none	none	none	none	none	none	none	none	none	none	none	none	none	none	none	none	none	none	none	none	none	none	none	none	none	lovell lodge	holy trinity church	10:30	none	none	none	none	none	none
SNG1322.json	1	Thank you! That will be all. 	I have booked you a blue toyota. The contact number is 07061402543 	none	none	none	none	none	none	none	none	none	none	none	none	none	none	none	none	none	none	none	none	none	none	none	none	none	none	lovell lodge	holy trinity church	10:30	none	none	none	none	none	none
SNG1246.json	0	i want to book a taxi. The taxi should depart from india house and should arrive by 24:00.		none	none	none	none	none	none	none	none	none	none	none	none	none	none	none	none	none	none	none	none	none	none	none	none	none	24:00	india house	none	none	none	none	none	none	none	none
SNG1246.json	1	Whale of a time is where I want to get to. 	What is the destination?	none	none	none	none	none	none	none	none	none	none	none	none	none	none	none	none	none	none	none	none	none	none	none	none	none	24:00	india house	whale of a time	none	none	none	none	none	none	none
SNG1246.json	2	No, thank you for your help! 	Ok, I have booked you a taxi. It will be a grey honda, contact number is 07502484881. Is there anything else I can help with today?	none	none	none	none	none	none	none	none	none	none	none	none	none	none	none	none	none	none	none	none	none	none	none	none	none	24:00	india house	whale of a time	none	none	none	none	none	none	none
SNG0067.json	0	Good morning! Can you help me get a taxi to take me from Clare College to Cambridge that gets there by 18:00?		none	none	none	none	none	none	none	none	none	none	none	none	none	none	none	none	none	none	none	none	none	none	none	none	none	18:00	clare college	cambridge	none	none	none	none	none	none	none
SNG0067.json	1	Please. Can I get the contact number and car type for that?	Yes, I have a car for that time, would you like me to book it?	none	none	none	none	none	none	none	none	none	none	none	none	none	none	none	none	none	none	none	none	none	none	none	none	none	18:00	clare college	cambridge	none	none	none	none	none	none	none
SNG0067.json	2	Actually, can I change the destination to Christ's College?	Yes, look out for a grey ford. The contact number is 07562472408. May I help with anything else?	none	none	none	none	none	none	none	none	none	none	none	none	none	none	none	none	none	none	none	none	none	none	none	none	none	18:00	clare college	christ's college	none	none	none	none	none	none	none
SNG0067.json	3	Yes. Could I have the contact number and car type for this trip?	Ok, so that was a cab leaving from clare college and going to christ's college arriving there at 18:00?	none	none	none	none	none	none	none	none	none	none	none	none	none	none	none	none	none	none	none	none	none	none	none	none	none	18:00	clare college	christ's college	none	none	none	none	none	none	none
SNG0067.json	4	That takes care of what I needed today. Thanks and have a good day. 	Yes, it will be a grey Ford and the contact number is 07562472408. What else can I help you with? 	none	none	none	none	none	none	none	none	none	none	none	none	none	none	none	none	none	none	none	none	none	none	none	none	none	18:00	clare college	christ's college	none	none	none	none	none	none	none
SNG1181.json	0	i want to book a taxi. The taxi should depart from pizza hut cherry hinton and should arrive by 01:30.		none	none	none	none	none	none	none	none	none	none	none	none	none	none	none	none	none	none	none	none	none	none	none	none	none	none	pizza hut cherry hinton	none	none	none	none	none	none	none	none
SNG1181.json	1	Yes, I want to book so I can get to kohinoor by 01:30.	Do you have a destination and time preference?	none	none	none	none	none	none	none	none	none	none	none	none	none	none	none	none	none	none	none	none	none	none	none	none	none	01:30	pizza hut cherry hinton	kohinoor	none	none	none	none	none	none	none
SNG1181.json	2	Thanks so much! I'm all set for my trip now! Bye!	Booking completed! Booked car type : red bmw Contact number : 07276200225 	none	none	none	none	none	none	none	none	none	none	none	none	none	none	none	none	none	none	none	none	none	none	none	none	none	01:30	pizza hut cherry hinton	kohinoor	none	none	none	none	none	none	none
SNG02322.json	0	I want a taxi to pick me up after 21:00 to take me to Little Saint Mary's Church.		none	none	none	none	none	none	none	none	none	none	none	none	none	none	none	none	none	none	none	none	none	none	none	none	none	none	none	little saint mary's church	21:00	none	none	none	none	none	none
SNG02322.json	1	I want to be picked up at frankie and bennys please	I can help with that - where are you leaving from?	none	none	none	none	none	none	none	none	none	none	none	none	none	none	none	none	none	none	none	none	none	none	none	none	none	none	frankie and bennys	little saint mary's church	21:00	none	none	none	none	none	none
SNG02322.json	2	Great, thank you for your help.	I've booked you a black Honda, the contact number is 07796011098.	none	none	none	none	none	none	none	none	none	none	none	none	none	none	none	none	none	none	none	none	none	none	none	none	none	none	frankie and bennys	little saint mary's church	21:00	none	none	none	none	none	none
SNG1279.json	0	i want to book a taxi. The taxi should depart from la Margarita and should go to riverboat Georgina.		none	none	none	none	none	none	none	none	none	none	none	none	none	none	none	none	none	none	none	none	none	none	none	none	none	none	la margherita	riverboat georgina	none	none	none	none	none	none	none
SNG1279.json	1	I would like to arrive by 17:15.	What time would you like to arrive?	none	none	none	none	none	none	none	none	none	none	none	none	none	none	none	none	none	none	none	none	none	none	none	none	none	17:15	la margherita	riverboat georgina	none	none	none	none	none	none	none
SNG1279.json	2	No, that is all I need today. Thanks!	I have a white tesla booked. The contact number is 07032807056. Anything else today?	none	none	none	none	none	none	none	none	none	none	none	none	none	none	none	none	none	none	none	none	none	none	none	none	none	17:15	la margherita	riverboat georgina	none	none	none	none	none	none	none
SNG01442.json	0	I need a taxi to pick me up from saigon city please		none	none	none	none	none	none	none	none	none	none	none	none	none	none	none	none	none	none	none	none	none	none	none	none	none	none	saigon city	none	none	none	none	none	none	none	none
SNG01442.json	1	I'd like to arrive by 15:45.	Sure! when would you like to arrive?	none	none	none	none	none	none	none	none	none	none	none	none	none	none	none	none	none	none	none	none	none	none	none	none	none	15:45	saigon city	none	none	none	none	none	none	none	none
SNG01442.json	2	I'll be heading to huntingdon marriott hotel.	And where will you be going?	none	none	none	none	none	none	none	none	none	none	none	none	none	none	none	none	none	none	none	none	none	none	none	none	none	15:45	saigon city	huntingdon marriott hotel	none	none	none	none	none	none	none
SNG01442.json	3	What is the contact number of that Audi?	Great! I was able to book a red Audi for you!	none	none	none	none	none	none	none	none	none	none	none	none	none	none	none	none	none	none	none	none	none	none	none	none	none	15:45	saigon city	huntingdon marriott hotel	none	none	none	none	none	none	none
SNG01442.json	4	Thank you that is all I need today.	The contact number is 07062991767. Do you have any other questions?	none	none	none	none	none	none	none	none	none	none	none	none	none	none	none	none	none	none	none	none	none	none	none	none	none	15:45	saigon city	huntingdon marriott hotel	none	none	none	none	none	none	none
SNG1265.json	0	I need a taxi from nusha to thanh binh at 6:15, please.		none	none	none	none	none	none	none	none	none	none	none	none	none	none	none	none	none	none	none	none	none	none	none	none	none	none	nusha	thanh binh	06:15	none	none	none	none	none	none
SNG1265.json	1	That is all I needed, thanks. 	A blue volkswagen will pick you up, and the contact number is 07337359188. Can I help with anything else?	none	none	none	none	none	none	none	none	none	none	none	none	none	none	none	none	none	none	none	none	none	none	none	none	none	none	nusha	thanh binh	06:15	none	none	none	none	none	none
SNG1265.json	2	Thank you, you too.	you are welcome. have a great day	none	none	none	none	none	none	none	none	none	none	none	none	none	none	none	none	none	none	none	none	none	none	none	none	none	none	nusha	thanh binh	06:15	none	none	none	none	none	none
SNG01521.json	0	I need to book a taxi to arrive by 06:45 to go to ADC Theatre.		none	none	none	none	none	none	none	none	none	none	none	none	none	none	none	none	none	none	none	none	none	none	none	none	none	06:45	none	adc theatre	none	none	none	none	none	none	none
SNG01521.json	1	I need to be picked up from Wagamama. 	Okay, what is your departure site?	none	none	none	none	none	none	none	none	none	none	none	none	none	none	none	none	none	none	none	none	none	none	none	none	none	06:45	wagamama	adc theatre	none	none	none	none	none	none	none
SNG01574.json	0	I need to book a taxi to take me to The Junction. I need it here by 18:15.		none	none	none	none	none	none	none	none	none	none	none	none	none	none	none	none	none	none	none	none	none	none	none	none	none	none	none	the junction	18:15	none	none	none	none	none	none
SNG01574.json	1	Yes, leave by 18:15 and from La Margherita.	I'd be happy to help - where should the taxi pick you up? And just to confirm - you need to leave at 18:15?	none	none	none	none	none	none	none	none	none	none	none	none	none	none	none	none	none	none	none	none	none	none	none	none	none	none	la margherita	the junction	18:15	none	none	none	none	none	none
SNG01574.json	2	Okay, thanks a lot. You have a great day.	Booking completed! Booked car type : blue volvo Contact number : 07423194148	none	none	none	none	none	none	none	none	none	none	none	none	none	none	none	none	none	none	none	none	none	none	none	none	none	none	la margherita	the junction	18:15	none	none	none	none	none	none
SNG1256.json	0	Hi, i need to book a taxi to go to funky fun house. I need to leave after 8:45. 		none	none	none	none	none	none	none	none	none	none	none	none	none	none	none	none	none	none	none	none	none	none	none	none	none	none	none	funky fun house	08:45	none	none	none	none	none	none
SNG1256.json	1	The taxi should depart from the cambridge punter	Where will you leave from?	none	none	none	none	none	none	none	none	none	none	none	none	none	none	none	none	none	none	none	none	none	none	none	none	none	none	the cambridge punter	funky fun house	08:45	none	none	none	none	none	none
SNG1256.json	2	No thanks, just needed a taxi. Have a great day!	Alrighty. I have a grey ford for you with the contact number 07266756209. Anything else you need?	none	none	none	none	none	none	none	none	none	none	none	none	none	none	none	none	none	none	none	none	none	none	none	none	none	none	the cambridge punter	funky fun house	08:45	none	none	none	none	none	none
SNG01843.json	0	I need a tax to cambridge train station.		none	none	none	none	none	none	none	none	none	none	none	none	none	none	none	none	none	none	none	none	none	none	none	none	none	none	none	cambridge train station	none	none	none	none	none	none	none
SNG01843.json	1	I'm at kymmoy	Where would you like to be picked up?	none	none	none	none	none	none	none	none	none	none	none	none	none	none	none	none	none	none	none	none	none	none	none	none	none	none	kymmoy	cambridge train station	none	none	none	none	none	none	none
SNG01843.json	2	I need to be picked up at 21:30.	When would you like your taxi to pick you up?	none	none	none	none	none	none	none	none	none	none	none	none	none	none	none	none	none	none	none	none	none	none	none	none	none	none	kymmoy	cambridge train station	21:30	none	none	none	none	none	none
SNG01843.json	3	That covers everything. Thanks so much. Goodbye.	Ok. I have booked for you a red skoda and the contact number is 07618237831. Anything else I can help you with?	none	none	none	none	none	none	none	none	none	none	none	none	none	none	none	none	none	none	none	none	none	none	none	none	none	none	kymmoy	cambridge train station	21:30	none	none	none	none	none	none
SNG1373.json	0	I need a taxi from finches bed and breakfast to Ian hong house. Please be here at 13:45. What is your phone number? What type of car?		none	none	none	none	none	none	none	none	none	none	none	none	none	none	none	none	none	none	none	none	none	none	none	none	none	none	finches bed and breakfast	none	13:45	none	none	none	none	none	none
SNG1373.json	1	I need to arrive to Ian hong house by 13:45.	Can you please provide me with a destination and arrival time? Thank you. 	none	none	none	none	none	none	none	none	none	none	none	none	none	none	none	none	none	none	none	none	none	none	none	none	none	none	finches bed and breakfast	ian hong	13:45	none	none	none	none	none	none
SNG1373.json	2	Thanks so much. That is all I needed.	Your taxi is booked. Your car is a blue volkswagen and contact number is 07602572766	none	none	none	none	none	none	none	none	none	none	none	none	none	none	none	none	none	none	none	none	none	none	none	none	none	none	finches bed and breakfast	ian hong	13:45	none	none	none	none	none	none
SNG1156.json	0	I need to book a taxi.		none	none	none	none	none	none	none	none	none	none	none	none	none	none	none	none	none	none	none	none	none	none	none	none	none	none	none	none	none	none	none	none	none	none	none
SNG1156.json	1	I need to leave from ely and get to sidney sussex college by 14:15.	I can help with that? What are your departure and destination sites, and what time do you need it?	none	none	none	none	none	none	none	none	none	none	none	none	none	none	none	none	none	none	none	none	none	none	none	none	none	14:15	ely train station	sidney sussex college	none	none	none	none	none	none	none
SNG1156.json	2	Thanks so much! That'll be it for me for today.	Booking completed! Booked car type : blue honda Contact number : 07229655312 	none	none	none	none	none	none	none	none	none	none	none	none	none	none	none	none	none	none	none	none	none	none	none	none	none	14:15	ely train station	sidney sussex college	none	none	none	none	none	none	none
SNG1326.json	0	i want to book a taxi. The taxi should go to little saint mary's church and should leave after 05:45.		none	none	none	none	none	none	none	none	none	none	none	none	none	none	none	none	none	none	none	none	none	none	none	none	none	none	none	little saint mary's church	05:45	none	none	none	none	none	none
SNG1326.json	1	I am departing from el shaddai. Can you provide me with what car will be picking me up and contact number?	What is your departure site?	none	none	none	none	none	none	none	none	none	none	none	none	none	none	none	none	none	none	none	none	none	none	none	none	none	none	el shaddai	little saint mary's church	05:45	none	none	none	none	none	none
SNG1326.json	2	Thank you. I think that is all I need today.	 Yes, it's booked for you! Booked car type : black lexus Contact number : 07566754071	none	none	none	none	none	none	none	none	none	none	none	none	none	none	none	none	none	none	none	none	none	none	none	none	none	none	el shaddai	little saint mary's church	05:45	none	none	none	none	none	none
SNG01287.json	0	I need a taxi to leave at 3 45 and get me from the cambridge belfry		none	none	none	none	none	none	none	none	none	none	none	none	none	none	none	none	none	none	none	none	none	none	none	none	none	none	the cambridge belfry	none	03:45	none	none	none	none	none	none
SNG01287.json	1	I will be going to the cow pizza kitchen and bar. 	Where will you be going to?	none	none	none	none	none	none	none	none	none	none	none	none	none	none	none	none	none	none	none	none	none	none	none	none	none	none	the cambridge belfry	the cow pizza kitchen and bar	03:45	none	none	none	none	none	none
SNG01287.json	2	Ok thank you for your assistance.	Ok I have a red bmw with contact number 07932775805 booked for you.	none	none	none	none	none	none	none	none	none	none	none	none	none	none	none	none	none	none	none	none	none	none	none	none	none	none	the cambridge belfry	the cow pizza kitchen and bar	03:45	none	none	none	none	none	none
SNG01375.json	0	I need a taxi to pick me up after 21:25 at The Cambridge Belfry.		none	none	none	none	none	none	none	none	none	none	none	none	none	none	none	none	none	none	none	none	none	none	none	none	none	none	the cambridge belfry	none	21:25	none	none	none	none	none	none
SNG01375.json	1	The taxi should go to the gardenia.	And where are you going?	none	none	none	none	none	none	none	none	none	none	none	none	none	none	none	none	none	none	none	none	none	none	none	none	none	none	the cambridge belfry	the gardenia	21:30	none	none	none	none	none	none
SNG01375.json	2	I'll also need the contact number please.	Your taxi will pick you up at 21:30. It is a grey Honda.	none	none	none	none	none	none	none	none	none	none	none	none	none	none	none	none	none	none	none	none	none	none	none	none	none	none	the cambridge belfry	the gardenia	21:30	none	none	none	none	none	none
SNG01375.json	3	Than you, I think that's all I need for now.	The contact number is 07650376516.	none	none	none	none	none	none	none	none	none	none	none	none	none	none	none	none	none	none	none	none	none	none	none	none	none	none	the cambridge belfry	the gardenia	21:30	none	none	none	none	none	none
SNG02120.json	0	I need a taxi to come to royal standard and take me to maharajah tandoori restaurant.		none	none	none	none	none	none	none	none	none	none	none	none	none	none	none	none	none	none	none	none	none	none	none	none	none	none	royal standard	maharajah tandoori restaurant	none	none	none	none	none	none	none
SNG02120.json	1	I need to leave after 14:30.	I would be happy to help with your request, but first I will need to know, what time you would like to leave/arrive?	none	none	none	none	none	none	none	none	none	none	none	none	none	none	none	none	none	none	none	none	none	none	none	none	none	none	royal standard	maharajah tandoori restaurant	14:30	none	none	none	none	none	none
SNG02020.json	0	I need a taxi to take me to fitzbillies restaurant		none	none	none	none	none	none	none	none	none	none	none	none	none	none	none	none	none	none	none	none	none	none	none	none	none	none	none	fitzbillies restaurant	none	none	none	none	none	none	none
SNG02020.json	1	From Kings lynn train station.	I would be happy to book that for you, where do you need picked up from?	none	none	none	none	none	none	none	none	none	none	none	none	none	none	none	none	none	none	none	none	none	none	none	none	none	none	kings lynn train station	fitzbillies restaurant	none	none	none	none	none	none	none
SNG02020.json	2	I need to leave after 20:00 please.	Ok, and what time will you need to arrive/leave?	none	none	none	none	none	none	none	none	none	none	none	none	none	none	none	none	none	none	none	none	none	none	none	none	none	none	kings lynn train station	fitzbillies restaurant	20:00	none	none	none	none	none	none
SNG02020.json	3	Thank you goodbye	Great. We have a black volkswagen booked for you. The driver's phone number is 07477854911	none	none	none	none	none	none	none	none	none	none	none	none	none	none	none	none	none	none	none	none	none	none	none	none	none	none	kings lynn train station	fitzbillies restaurant	20:00	none	none	none	none	none	none
SNG02010.json	0	Taxi to de luca cucina and bar please		none	none	none	none	none	none	none	none	none	none	none	none	none	none	none	none	none	none	none	none	none	none	none	de luca cucina and bar	none	none	none	de luca cucina and bar	none	none	none	none	none	none	none
SNG02010.json	1	I need to arrive by 15:30, please.	What time would you like to arrive at your destination?	none	none	none	none	none	none	none	none	none	none	none	none	none	none	none	none	none	none	none	none	none	none	none	de luca cucina and bar	none	none	none	de luca cucina and bar	none	none	none	none	none	none	none
SNG01908.json	0	Can you set up a taxi to loch fyne from hakka for me?		none	none	none	none	none	none	none	none	none	none	none	none	none	none	none	none	none	none	none	none	none	none	none	none	none	none	hakka	loch fyne	none	none	none	none	none	none	none
SNG01908.json	1	I actually need to leave after 23:00	Sure! when would you like to arrive?	none	none	none	none	none	none	none	none	none	none	none	none	none	none	none	none	none	none	none	none	none	none	none	none	none	none	hakka	loch fyne	23:00	none	none	none	none	none	none
SNG01908.json	2	Yes I need the car type and contact number.	I've just booked a taxi for you, is there anything else I can help you with?	none	none	none	none	none	none	none	none	none	none	none	none	none	none	none	none	none	none	none	none	none	none	none	none	none	none	hakka	loch fyne	23:00	none	none	none	none	none	none
SNG01908.json	3	Got it, thanks. Goodbye.	Ok it's a white volvo and the contact number is 07915907755.	none	none	none	none	none	none	none	none	none	none	none	none	none	none	none	none	none	none	none	none	none	none	none	none	none	none	hakka	loch fyne	23:00	none	none	none	none	none	none
SNG01863.json	0	I'm at Kettle's Yard and need a taxi to pick me up by 19:30.		none	none	none	none	none	none	none	none	none	none	none	none	none	none	none	none	none	none	none	none	none	none	none	none	none	none	kettle's yard	none	19:30	none	none	none	none	none	none
