# Dialogue ID	Turn Index	User Utterance	System Response	attraction-area	attraction-name	attraction-type	bus-day	bus-departure	bus-destination	bus-leaveAt	hospital-department	hotel-area	hotel-book day	hotel-book people	hotel-book stay	hotel-internet	hotel-name	hotel-parking	hotel-price range	hotel-stars	hotel-type	restaurant-area	restaurant-book day	restaurant-book people	restaurant-book time	restaurant-food	restaurant-name	restaurant-price range	taxi-arrive by	taxi-departure	taxi-destination	taxi-leave at	train-arrive by	train-book people	train-day	train-departure	train-destination	train-leave at	
SNG01605.json	2	I want to go to restaurant two two.	What is your destination?	none	none	none	none	none	none	none	none	none	none	none	none	none	none	none	none	none	none	none	none	none	none	none	none	none	21:00	whipple museum of the history of science	restaurant two two	none	none	none	none	none	none	none
SNG01605.json	3	I'd like to arrive at Restaurant Two Two by 21:00 please.	And do you want to be picked up from whipple museum at 2100 or get to restaurant two two at 2100?	none	none	none	none	none	none	none	none	none	none	none	none	none	none	none	none	none	none	none	none	none	none	none	none	none	21:00	whipple museum of the history of science	restaurant two two	none	none	none	none	none	none	none
SNG01605.json	4	Great thanks! That's all I need.	Great I have you booked in a grey lexus and the contact number is 07398176919.	none	none	none	none	none	none	none	none	none	none	none	none	none	none	none	none	none	none	none	none	none	none	none	none	none	21:00	whipple museum of the history of science	restaurant two two	none	none	none	none	none	none	none
SNG1358.json	0	i want to book a taxi. The taxi should depart from broxbourne train station		none	none	none	none	none	none	none	none	none	none	none	none	none	none	none	none	none	none	none	none	none	none	none	none	none	none	broxbourne train station	none	none	none	none	none	none	none	none
SNG1358.json	1	I need to leave by 20:15 and am headed to city stop restaurant.	Where would you like to go?	none	none	none	none	none	none	none	none	none	none	none	none	none	none	none	none	none	none	none	none	none	none	none	none	none	none	broxbourne train station	city stop restaurant	20:15	none	none	none	none	none	none
SNG1358.json	2	Thank you. I am all set. Have a great day. 	I have booked you a blue BMW for a 20:15 pickup. The contact number is 07753733237. Can I help you with anything else today? . 	none	none	none	none	none	none	none	none	none	none	none	none	none	none	none	none	none	none	none	none	none	none	none	none	none	none	broxbourne train station	city stop restaurant	20:15	none	none	none	none	none	none
SNG1153.json	0	i want to book a taxi. The taxi should leave after 05:45 and should depart from the missing sock.		none	none	none	none	none	none	none	none	none	none	none	none	none	none	none	none	none	none	none	none	none	none	none	none	none	none	the missing sock	none	06:00	none	none	none	none	none	none
SNG1153.json	1	I would like to go to great saint mary's church. 	What is the destination you are trying to get to?	none	none	none	none	none	none	none	none	none	none	none	none	none	none	none	none	none	none	none	none	none	none	none	none	none	none	the missing sock	great saint mary's church	none	none	none	none	none	none	none
SNG1153.json	2	No that was it. Thank you very much!	I booked you a black bmw at with a contact number of 07939407760. Is there anything else? 	none	none	none	none	none	none	none	none	none	none	none	none	none	none	none	none	none	none	none	none	none	none	none	none	none	none	the missing sock	great saint mary's church	none	none	none	none	none	none	none
SNG1175.json	0	I need to book a taxi from Kings college to Pizza express Fen Ditton sometime after 17:15. I need the car type and contact number please.		none	none	none	none	none	none	none	none	none	none	none	none	none	none	none	none	none	none	none	none	none	none	none	none	none	none	king's college	pizza express fen ditton	17:15	none	none	none	none	none	none
SNG1175.json	1	Thank you! That will be all!	Okay, I have successfully booked the taxi for you. It is a grey lexus and the contact number is 07607911761. 	none	none	none	none	none	none	none	none	none	none	none	none	none	none	none	none	none	none	none	none	none	none	none	none	none	none	king's college	pizza express fen ditton	17:15	none	none	none	none	none	none
SNG01618.json	0	I need a taxi to take me today to camboats		none	none	none	none	none	none	none	none	none	none	none	none	none	none	none	none	none	none	none	none	none	none	none	none	none	none	none	camboats	none	none	none	none	none	none	none
SNG01618.json	1	kings hedges learner pool	Okay, where is your departure site?	none	none	none	none	none	none	none	none	none	none	none	none	none	none	none	none	none	none	none	none	none	none	none	none	none	none	kings hedges learner pool	camboats	none	none	none	none	none	none	none
SNG01618.json	2	I want to arrive by 02:45.	Great. and now I will just need a time from you please	none	none	none	none	none	none	none	none	none	none	none	none	none	none	none	none	none	none	none	none	none	none	none	none	none	02:45	kings hedges learner pool	camboats	none	none	none	none	none	none	none
SNG01618.json	3	Fabulous. Thanks so much for your help. Bye!	I have booked you a blue audi with contact number 07255776269.	none	none	none	none	none	none	none	none	none	none	none	none	none	none	none	none	none	none	none	none	none	none	none	none	none	02:45	kings hedges learner pool	camboats	none	none	none	none	none	none	none
SNG02009.json	0	I need a taxi to take me to rajmahal. 		none	none	none	none	none	none	none	none	none	none	none	none	none	none	none	none	none	none	none	none	none	none	none	none	none	none	none	rajmahal	none	none	none	none	none	none	none
SNG02009.json	1	I'm leaving from gallery at twelve a high street.	Where will you be departing from?	none	none	none	none	none	none	none	none	none	none	none	none	none	none	none	none	none	none	none	none	none	none	none	none	none	none	gallery at twelve a high street	rajmahal	none	none	none	none	none	none	none
SNG02009.json	2	I would like to leave after 3:45.	And when would you like to leave?	none	none	none	none	none	none	none	none	none	none	none	none	none	none	none	none	none	none	none	none	none	none	none	none	none	none	gallery at twelve a high street	rajmahal	3:45	none	none	none	none	none	none
SNG02009.json	3	Thank you, can you give me the contact number please?	I have you booked in a grey audi.	none	none	none	none	none	none	none	none	none	none	none	none	none	none	none	none	none	none	none	none	none	none	none	none	none	none	gallery at twelve a high street	rajmahal	3:45	none	none	none	none	none	none
SNG02009.json	4	Thank you for your help. 	Contact number is 07270553802 	none	none	none	none	none	none	none	none	none	none	none	none	none	none	none	none	none	none	none	none	none	none	none	none	none	none	gallery at twelve a high street	rajmahal	3:45	none	none	none	none	none	none
SNG02009.json	5	No, that's it. Thank you so much!	You're quite welcome. Is there anything else I can assist you with?	none	none	none	none	none	none	none	none	none	none	none	none	none	none	none	none	none	none	none	none	none	none	none	none	none	none	gallery at twelve a high street	rajmahal	3:45	none	none	none	none	none	none
SNG01283.json	0	I would like a taxi to curry king please.		none	none	none	none	none	none	none	none	none	none	none	none	none	none	none	none	none	none	none	none	none	none	none	none	none	none	none	curry king	none	none	none	none	none	none	none
SNG01283.json	1	I'm departing from sheep's green and lammas land park fen causeway. 	Sure, first I'll need to know where you need picked up from. 	none	none	none	none	none	none	none	none	none	none	none	none	none	none	none	none	none	none	none	none	none	none	none	none	none	none	sheep's green and lammas land park fen causeway	curry king	none	none	none	none	none	none	none
SNG01283.json	2	I just need to be sure to arrive by 07:15.	I can help you with that. When do you need to leave?	none	none	none	none	none	none	none	none	none	none	none	none	none	none	none	none	none	none	none	none	none	none	none	none	none	07:15	sheep's green and lammas land park fen causeway	curry king	none	none	none	none	none	none	none
SNG01283.json	3	When will the taxi pick me up?	I have a black bmw with contact number 07975360345.	none	none	none	none	none	none	none	none	none	none	none	none	none	none	none	none	none	none	none	none	none	none	none	none	none	07:15	sheep's green and lammas land park fen causeway	curry king	none	none	none	none	none	none	none
SNG01283.json	4	Will that get me to my destination on time?	Would 6:45 be a convenient time for you to leave? 	none	none	none	none	none	none	none	none	none	none	none	none	none	none	none	none	none	none	none	none	none	none	none	none	none	07:15	sheep's green and lammas land park fen causeway	curry king	none	none	none	none	none	none	none
SNG01283.json	5	Thank you goodbye	Yes, the trip takes about fifteen minutes so you will arrive in time even if there is a little traffic.	none	none	none	none	none	none	none	none	none	none	none	none	none	none	none	none	none	none	none	none	none	none	none	none	none	07:15	sheep's green and lammas land park fen causeway	curry king	none	none	none	none	none	none	none
SNG01250.json	0	Reserve a taxi to jinling noodle bar for me		none	none	none	none	none	none	none	none	none	none	none	none	none	none	none	none	none	none	none	none	none	none	none	none	none	none	none	jinling noodle bar	none	none	none	none	none	none	none
SNG01250.json	1	I need to arrive by 24:15	Sure! when would you like to arrive?	none	none	none	none	none	none	none	none	none	none	none	none	none	none	none	none	none	none	none	none	none	none	none	none	none	24:15	none	jinling noodle bar	none	none	none	none	none	none	none
SNG01250.json	2	I will be leaving from pembroke college.	Where will you be leaving from?	none	none	none	none	none	none	none	none	none	none	none	none	none	none	none	none	none	none	none	none	none	none	none	none	none	24:15	pembroke college	jinling noodle bar	none	none	none	none	none	none	none
SNG01250.json	3	Thanks so much for your help!	A grey volvo will be picking you up at pembroke college. Their contact number is 07248087755 if you have any questions.	none	none	none	none	none	none	none	none	none	none	none	none	none	none	none	none	none	none	none	none	none	none	none	none	none	24:15	pembroke college	jinling noodle bar	none	none	none	none	none	none	none
SNG01250.json	4	No, that's all that I need today. Thank you!	You are welcome. Do you need any other Cambridge bookings?	none	none	none	none	none	none	none	none	none	none	none	none	none	none	none	none	none	none	none	none	none	none	none	none	none	24:15	pembroke college	jinling noodle bar	none	none	none	none	none	none	none
SNG01701.json	0	I need to book a taxi to take me to Riverside Brasserie at 11:15.		none	none	none	none	none	none	none	none	none	none	none	none	none	none	none	none	none	none	none	none	none	none	none	none	none	none	none	riverside brasserie	11:15	none	none	none	none	none	none
SNG01701.json	1	I'm going to riverside brasserie.	Sure thing, where are you going?	none	none	none	none	none	none	none	none	none	none	none	none	none	none	none	none	none	none	none	none	none	none	none	none	none	none	none	riverside brasserie	11:15	none	none	none	none	none	none
SNG01701.json	2	I'm leaving from the Marriott Hotel in downtown Cambridge next to the theatre.	Where will you leave from?	none	none	none	none	none	none	none	none	none	none	none	none	none	none	none	none	none	none	none	none	none	none	none	none	none	none	huntingdon marriott hotel	riverside brasserie	11:15	none	none	none	none	none	none
SNG01701.json	3	No, sorry I'm actually departing from saint johns chop house.	Is that the huntingdon marriott hotel?	none	none	none	none	none	none	none	none	none	none	none	none	none	none	none	none	none	none	none	none	none	none	none	none	none	none	saint johns chop house	riverside brasserie	11:15	none	none	none	none	none	none
SNG01701.json	4	Yes, but I want to leave after 11:15. When you book it can you get me the car type and contact number please?	Ok, just to confirm, you'd like a taxi from saint johns chop house to riverside brasserie at 11:15?	none	none	none	none	none	none	none	none	none	none	none	none	none	none	none	none	none	none	none	none	none	none	none	none	none	none	saint johns chop house	riverside brasserie	11:15	none	none	none	none	none	none
SNG01701.json	5	Thank you, that's all I need. Good bye.	All right, sir, you'll be picked up in a blue BMW. The contact number is 07348606520.	none	none	none	none	none	none	none	none	none	none	none	none	none	none	none	none	none	none	none	none	none	none	none	none	none	none	saint johns chop house	riverside brasserie	11:15	none	none	none	none	none	none
SNG01565.json	0	Please help me reserve a taxi from saint catharine's college		none	none	none	none	none	none	none	none	none	none	none	none	none	none	none	none	none	none	none	none	none	none	none	none	none	none	saint catharine's college	none	none	none	none	none	none	none	none
SNG01565.json	1	I would like to arrive by 01:15.	Sure! when would you like to arrive?	none	none	none	none	none	none	none	none	none	none	none	none	none	none	none	none	none	none	none	none	none	none	none	none	none	01:15	saint catharine's college	none	none	none	none	none	none	none	none
SNG01565.json	2	I'm going to loch fyne.	Great! And what is your destination?	none	none	none	none	none	none	none	none	none	none	none	none	none	none	none	none	none	none	none	none	none	none	none	none	none	01:15	saint catharine's college	loch fyne	none	none	none	none	none	none	none
SNG01565.json	3	Thank you. I am now finished.	You are booked for a red lexus with the contact number 07866626052.	none	none	none	none	none	none	none	none	none	none	none	none	none	none	none	none	none	none	none	none	none	none	none	none	none	01:15	saint catharine's college	loch fyne	none	none	none	none	none	none	none
SNG01189.json	0	Hi! I need a taxi from little saint mary's church to trinity college. I sure hope you can help me!		none	none	none	none	none	none	none	none	none	none	none	none	none	none	none	none	none	none	none	none	none	none	none	none	none	none	little saint mary's church	trinity college	none	none	none	none	none	none	none
SNG01189.json	1	I need to leave after 24:45.	Sure thing, when you like to leave by?	none	none	none	none	none	none	none	none	none	none	none	none	none	none	none	none	none	none	none	none	none	none	none	none	none	none	little saint mary's church	trinity college	24:45	none	none	none	none	none	none
SNG01189.json	2	I'll also need the contact number.	Your booking is complete, a grey toyota will be picking you up.	none	none	none	none	none	none	none	none	none	none	none	none	none	none	none	none	none	none	none	none	none	none	none	none	none	none	little saint mary's church	trinity college	24:45	none	none	none	none	none	none
SNG01189.json	3	No, that's it. Thank you.	Of course, the number is 07655357606. Can I help with anything else?	none	none	none	none	none	none	none	none	none	none	none	none	none	none	none	none	none	none	none	none	none	none	none	none	none	none	little saint mary's church	trinity college	24:45	none	none	none	none	none	none
SNG01238.json	0	Send a taxi to the Parkside Police Station to go to Little Seoul		none	none	none	none	none	none	none	none	none	none	none	none	none	none	none	none	none	none	none	none	none	none	none	none	none	none	parkside police station	little seoul	none	none	none	none	none	none	none
SNG01238.json	1	I would like to gt there by 6:30. 	Do you have a frame of time you would like to arrive or leave in?	none	none	none	none	none	none	none	none	none	none	none	none	none	none	none	none	none	none	none	none	none	none	none	none	none	06:30	parkside police station	little seoul	none	none	none	none	none	none	none
SNG0036.json	0	Hello there. I was wondering if you could help me arrange for a taxi to take me from the Cherry Hinton Village Centre to La Raza?		none	none	none	none	none	none	none	none	none	none	none	none	none	none	none	none	none	none	none	none	none	none	none	none	none	none	the cherry hinton village centre	la raza	none	none	none	none	none	none	none
SNG0036.json	1	I need to leave after 10:15. may i have the contact number for taxi please?	Certainly! Do you have an arrival or departure time in mind?	none	none	none	none	none	none	none	none	none	none	none	none	none	none	none	none	none	none	none	none	none	none	none	none	none	none	the cherry hinton village centre	la raza	10:15	none	none	none	none	none	none
SNG0036.json	2	Thank you very much! 	Absolutely. The contact number is 07862333057	none	none	none	none	none	none	none	none	none	none	none	none	none	none	none	none	none	none	none	none	none	none	none	none	none	none	the cherry hinton village centre	la raza	10:15	none	none	none	none	none	none
SNG0036.json	3	Yes I need the taxi to depart from the cherry hinton village and go to la raza. Leaving after 10:15. Please give me the contact number and car type.	Would you like me to book the taxi?	none	none	none	none	none	none	none	none	none	none	none	none	none	none	none	none	none	none	none	none	none	none	none	none	none	none	the cherry hinton village centre	la raza	10:15	none	none	none	none	none	none
SNG0036.json	4	No, that will be all, thank you. Have a nice day.	Okay, the taxi is booked. The contact number is 07862333057, the car will be a Blue Honda. Is there anything else I can help with?	none	none	none	none	none	none	none	none	none	none	none	none	none	none	none	none	none	none	none	none	none	none	none	none	none	none	the cherry hinton village centre	la raza	10:15	none	none	none	none	none	none
SNG1233.json	0	You want to book a taxi. The taxi should arrive by 17:30 and should go to la mimosa.		none	none	none	none	none	none	none	none	none	none	none	none	none	none	none	none	none	none	none	none	none	none	none	none	none	17:30	none	la mimosa	none	none	none	none	none	none	none
SNG1233.json	1	I will be departing from nusha. 	Ok. And where will the taxi be picking you up from? 	none	none	none	none	none	none	none	none	none	none	none	none	none	none	none	none	none	none	none	none	none	none	none	none	none	17:30	nusha	la mimosa	none	none	none	none	none	none	none
SNG1233.json	2	Thanks so much! That's it for today. Have a good one!	A black audi is booked for you, with contact number 07400946146	none	none	none	none	none	none	none	none	none	none	none	none	none	none	none	none	none	none	none	none	none	none	none	none	none	17:30	nusha	la mimosa	none	none	none	none	none	none	none
SNG02199.json	0	I'll be needing a taxi from nandos city centre		none	none	none	none	none	none	none	none	none	none	none	none	none	none	none	none	none	none	none	none	none	none	none	none	none	none	nandos city centre	none	none	none	none	none	none	none	none
SNG02199.json	1	I need to go to the castle galleries.	Where will you be heading to?	none	none	none	none	none	none	none	none	none	none	none	none	none	none	none	none	none	none	none	none	none	none	none	none	none	none	nandos city centre	castle galleries	none	none	none	none	none	none	none
SNG02199.json	2	I need to leave after 04:30.	What time would you like to leave?	none	none	none	none	none	none	none	none	none	none	none	none	none	none	none	none	none	none	none	none	none	none	none	none	none	none	nandos city centre	castle galleries	04:30	none	none	none	none	none	none
SNG02199.json	3	Ok thanks, that's all i need.	 Booking completed! Booked car type : blue toyota Contact number : 07920865012	none	none	none	none	none	none	none	none	none	none	none	none	none	none	none	none	none	none	none	none	none	none	none	none	none	none	nandos city centre	castle galleries	04:30	none	none	none	none	none	none
SNG0089.json	0	I would like to book a taxi that would pick me up from sesame restaurant and bar that would pick me up at 14:00		none	none	none	none	none	none	none	none	none	none	none	none	none	none	none	none	none	none	none	none	none	none	none	none	none	none	none	none	14:00	none	none	none	none	none	none
SNG0089.json	1	I need to go to St John's Chop House. I would like a contact number and car type for my booking query.	And where will the taxi be taking you?	none	none	none	none	none	none	none	none	none	none	none	none	none	none	none	none	none	none	none	none	none	none	none	none	none	none	sesame restaurant and bar	st johns chop house	14:00	none	none	none	none	none	none
SNG0089.json	2	Thank you, that is all I needed.	Your taxi will be a grey Lexus with the contact number 07097363308.	none	none	none	none	none	none	none	none	none	none	none	none	none	none	none	none	none	none	none	none	none	none	none	none	none	none	sesame restaurant and bar	st johns chop house	14:00	none	none	none	none	none	none
SNG01572.json	0	I will be needing a taxi from broxbourne train station		none	none	none	none	none	none	none	none	none	none	none	none	none	none	none	none	none	none	none	none	none	none	none	none	none	none	broxbourne train station	none	none	none	none	none	none	none	none
SNG01572.json	1	I must arrive there by 23:30	Sure thing, when would you like to arrive or leave by?	none	none	none	none	none	none	none	none	none	none	none	none	none	none	none	none	none	none	none	none	none	none	none	none	none	23:30	broxbourne train station	none	none	none	none	none	none	none	none
SNG01572.json	2	I'm going to india house.	Okay, where are you headed?	none	none	none	none	none	none	none	none	none	none	none	none	none	none	none	none	none	none	none	none	none	none	none	none	none	23:30	broxbourne train station	india house	none	none	none	none	none	none	none
SNG01572.json	3	Nope. That should be it. Thank you so much for your help.	You car type is a red skoda. The contact number is 07699858480. Can I assist you with anything else?	none	none	none	none	none	none	none	none	none	none	none	none	none	none	none	none	none	none	none	none	none	none	none	none	none	23:30	broxbourne train station	india house	none	none	none	none	none	none	none
SNG02301.json	0	Can you help me get a taxi to pizza express Fen Ditton?		none	none	none	none	none	none	none	none	none	none	none	none	none	none	none	none	none	none	none	none	none	none	none	none	none	none	none	pizza express fen ditton	none	none	none	none	none	none	none
SNG02301.json	1	I want to depart from sidney sussex college. 	Sure! Where do you want to depart from?	none	none	none	none	none	none	none	none	none	none	none	none	none	none	none	none	none	none	none	none	none	none	none	none	none	none	sidney sussex college	pizza express fen ditton	none	none	none	none	none	none	none
SNG02301.json	2	I can't leave until after 11:45 please.	Great. Now I'll just need a time from you please.	none	none	none	none	none	none	none	none	none	none	none	none	none	none	none	none	none	none	none	none	none	none	none	none	none	none	sidney sussex college	pizza express fen ditton	after 11:45	none	none	none	none	none	none
SNG02301.json	3	No that is all I need.	Ok, you will be riding in a black bmw, the contact number is 07196618284, is there anything else I can help you with today?	none	none	none	none	none	none	none	none	none	none	none	none	none	none	none	none	none	none	none	none	none	none	none	none	none	none	sidney sussex college	pizza express fen ditton	after 11:45	none	none	none	none	none	none
SNG01564.json	0	I need a taxi to the good luck chinese food takeaway. 		none	none	none	none	none	none	none	none	none	none	none	none	none	none	none	none	none	none	none	none	none	none	none	none	none	none	none	the good luck chinese food takeaway	none	none	none	none	none	none	none
SNG01564.json	1	I would like to be picked up at the Bloomsbury Restaurant.	I would be happy to help with your request, where will you need picked up?	none	none	none	none	none	none	none	none	none	none	none	none	none	none	none	none	none	none	none	none	none	none	none	none	none	none	bloomsbury restaurant	the good luck chinese food takeaway	none	none	none	none	none	none	none
SNG01564.json	2	I want to be picked up after 03:15, please.	When would you like to be picked up?	none	none	none	none	none	none	none	none	none	none	none	none	none	none	none	none	none	none	none	none	none	none	none	none	none	none	bloomsbury restaurant	the good luck chinese food takeaway	03:30	none	none	none	none	none	none
SNG01564.json	3	Great! Thank you so much!	You are booked on a black skoda with the contact number 07423023261.	none	none	none	none	none	none	none	none	none	none	none	none	none	none	none	none	none	none	none	none	none	none	none	none	none	none	bloomsbury restaurant	the good luck chinese food takeaway	03:30	none	none	none	none	none	none
SNG01564.json	4	No, you have taken care of everything. Goodbye.	You are most welcome. Do you have any other requests?	none	none	none	none	none	none	none	none	none	none	none	none	none	none	none	none	none	none	none	none	none	none	none	none	none	none	bloomsbury restaurant	the good luck chinese food takeaway	03:30	none	none	none	none	none	none
SNG01338.json	0	I need a taxi going to the varsity restaurant.		none	none	none	none	none	none	none	none	none	none	none	none	none	none	none	none	none	none	none	none	none	none	none	none	none	none	none	the varsity restaurant	none	none	none	none	none	none	none
SNG01338.json	1	I'm leaving from gonville hotel.	Where will you depart from?	none	none	none	none	none	none	none	none	none	none	none	none	none	none	none	none	none	none	none	none	none	none	none	none	none	none	gonville hotel	the varsity restaurant	none	none	none	none	none	none	none
SNG01338.json	2	I want to leave at 12:00.	I can help you with that. When do you need to leave?	none	none	none	none	none	none	none	none	none	none	none	none	none	none	none	none	none	none	none	none	none	none	none	none	none	none	gonville hotel	the varsity restaurant	12:00	none	none	none	none	none	none
SNG01338.json	3	Ok thank you that is all I needed today. Goodbye.	I have a blue honda with contact number 07255247278.	none	none	none	none	none	none	none	none	none	none	none	none	none	none	none	none	none	none	none	none	none	none	none	none	none	none	gonville hotel	the varsity restaurant	12:00	none	none	none	none	none	none
